<?xml version="1.0" encoding="ISO-8859-1" ?>
<!DOCTYPE program [
<!ATTLIST program name CDATA #REQUIRED>
<!ELEMENT program (cfgs,srcfile*)>
<!ELEMENT cfgs (cfg*)>
<!ATTLIST cfg
   id ID #REQUIRED
   main CDATA #IMPLIED
   name CDATA #IMPLIED>
<!ELEMENT cfg (bb+)>
<!ATTLIST bb id ID #REQUIRED>
<!ELEMENT bb (prec?,inst*,succ?)>
<!ELEMENT prec (link+)>
<!ELEMENT succ (link+)>
<!ATTLIST link
   type (taken|nottaken|call) #REQUIRED
   cfg IDREF #REQUIRED
   bb IDREF #REQUIRED
   cond CDATA #IMPLIED>
<!ELEMENT link EMPTY>
<!ATTLIST inst
   src IDREF #IMPLIED
   line CDATA #IMPLIED
   addr CDATA #REQUIRED
   type (ipoint|label|op|jump|branch|call|ret) #IMPLIED
   name CDATA #IMPLIED
   operands CDATA #IMPLIED
   cond CDATA #IMPLIED>
<!ELEMENT inst EMPTY>
<!ATTLIST srcfile
   id ID #REQUIRED
   name CDATA #IMPLIED>
<!ELEMENT srcfile (#PCDATA)>
]>

<program name="main">
   <cfgs>
      <cfg id="c6" name="gnc__passive__opcs__compute" main="true">
         <bb id="c6b1">
            <inst addr="0x40006A94" src="s1" line="11"/>
            <inst addr="0x40006A98"/>
            <inst addr="0x40006A9C" src="s1" line="12"/>
            <inst addr="0x40006AA0" src="s1" line="14"/>
            <inst addr="0x40006AA4"/>
            <inst addr="0x40006AA8"/>
            <inst addr="0x40006AAC" src="s1" line="15"/>
            <inst addr="0x40006AB0"/>
            <inst addr="0x40006AB4"/>
            <inst addr="0x40006AB8" src="s1" line="16"/>
            <succ>
               <link type="nottaken" cfg="c6" bb="c6b2"/>
            </succ>
         </bb>
         <bb id="c6b2">
            <prec>
               <link type="nottaken" cfg="c6" bb="c6b1"/>
               <link type="nottaken" cfg="c6" bb="c6b12"/>
            </prec>
            <inst addr="0x40006ABC"/>
            <inst addr="0x40006AC0"/>
            <inst addr="0x40006AC4"/>
            <succ>
               <link type="nottaken" cfg="c6" bb="c6b3"/>
               <link type="taken" cfg="c6" bb="c6b4"/>
            </succ>
         </bb>
         <bb id="c6b3">
            <prec>
               <link type="nottaken" cfg="c6" bb="c6b2"/>
            </prec>
            <inst addr="0x40006AC8"/>
            <inst addr="0x40006ACC" src="s1" line="22"/>
            <inst addr="0x40006AD0"/>
            <succ>
               <link type="call" cfg="c7" bb="c7b1"/>
               <link type="nottaken" cfg="c6" bb="c6b7"/>
            </succ>
         </bb>
         <bb id="c6b4">
            <prec>
               <link type="taken" cfg="c6" bb="c6b2"/>
            </prec>
            <inst addr="0x40006AC8"/>
            <inst addr="0x40006AF0" src="s1" line="29"/>
            <inst addr="0x40006AF4"/>
            <inst addr="0x40006AF8"/>
            <inst addr="0x40006AFC" src="s1" line="30"/>
            <inst addr="0x40006B00"/>
            <succ>
               <link type="nottaken" cfg="c6" bb="c6b6"/>
            </succ>
         </bb>
         <bb id="c6b6">
            <prec>
               <link type="nottaken" cfg="c6" bb="c6b4"/>
               <link type="nottaken" cfg="c6" bb="c6b13"/>
            </prec>
            <inst addr="0x40006B04"/>
            <inst addr="0x40006B08"/>
            <inst addr="0x40006B0C"/>
            <succ>
               <link type="nottaken" cfg="c6" bb="c6b8"/>
               <link type="taken" cfg="c6" bb="c6b9"/>
            </succ>
         </bb>
         <bb id="c6b7">
            <prec>
               <link type="nottaken" cfg="c6" bb="c6b3"/>
            </prec>
            <inst addr="0x40006AD4" src="s1" line="26"/>
            <inst addr="0x40006AD8"/>
            <succ>
               <link type="call" cfg="c8" bb="c8b1"/>
               <link type="nottaken" cfg="c6" bb="c6b12"/>
            </succ>
         </bb>
         <bb id="c6b8">
            <prec>
               <link type="nottaken" cfg="c6" bb="c6b6"/>
            </prec>
            <inst addr="0x40006B10"/>
            <inst addr="0x40006B14" src="s1" line="32"/>
            <inst addr="0x40006B18"/>
            <succ>
               <link type="call" cfg="c9" bb="c9b1"/>
               <link type="nottaken" cfg="c6" bb="c6b13"/>
            </succ>
         </bb>
         <bb id="c6b9">
            <prec>
               <link type="taken" cfg="c6" bb="c6b6"/>
            </prec>
            <inst addr="0x40006B10"/>
            <inst addr="0x40006B30" src="s1" line="35"/>
            <inst addr="0x40006B34"/>
            <inst addr="0x40006B38"/>
            <inst addr="0x40006B3C" src="s1" line="11"/>
            <inst addr="0x40006B40" src="s1" line="37"/>
            <inst addr="0x40006B44"/>
            <inst addr="0x40006B48"/>
            <inst addr="0x40006B4C"/>
         </bb>
         <bb id="c6b12">
            <prec>
               <link type="nottaken" cfg="c6" bb="c6b7"/>
            </prec>
            <inst addr="0x40006ADC" src="s1" line="16"/>
            <inst addr="0x40006AE0"/>
            <inst addr="0x40006AE4"/>
            <inst addr="0x40006AE8" src="s1" line="28"/>
            <inst addr="0x40006AEC"/>
            <succ>
               <link type="nottaken" cfg="c6" bb="c6b2"/>
            </succ>
         </bb>
         <bb id="c6b13">
            <prec>
               <link type="nottaken" cfg="c6" bb="c6b8"/>
            </prec>
            <inst addr="0x40006B1C" src="s1" line="30"/>
            <inst addr="0x40006B20"/>
            <inst addr="0x40006B24"/>
            <inst addr="0x40006B28" src="s1" line="33"/>
            <inst addr="0x40006B2C"/>
            <succ>
               <link type="nottaken" cfg="c6" bb="c6b6"/>
            </succ>
         </bb>
      </cfg>
      <cfg id="c7" name="xgnc__aocs">
         <bb id="c7b1">
            <prec>
               <link type="call" cfg="c6" bb="c6b3"/>
            </prec>
            <inst addr="0x40006914" src="s2" line="34"/>
            <inst addr="0x40006918" src="s2" line="38"/>
            <inst addr="0x4000691C"/>
            <inst addr="0x40006920"/>
            <inst addr="0x40006924"/>
            <inst addr="0x40006928"/>
            <inst addr="0x4000692C"/>
            <inst addr="0x40006930"/>
            <inst addr="0x40006934"/>
            <inst addr="0x40006938"/>
            <succ>
               <link type="call" cfg="c12" bb="c12b1"/>
               <link type="nottaken" cfg="c7" bb="c7b3"/>
            </succ>
         </bb>
         <bb id="c7b3">
            <prec>
               <link type="nottaken" cfg="c7" bb="c7b1"/>
            </prec>
            <inst addr="0x4000693C" src="s2" line="40"/>
            <inst addr="0x40006940"/>
            <inst addr="0x40006944"/>
            <inst addr="0x40006948"/>
            <inst addr="0x4000694C"/>
            <inst addr="0x40006950"/>
            <succ>
               <link type="call" cfg="c13" bb="c13b1"/>
               <link type="nottaken" cfg="c7" bb="c7b5"/>
            </succ>
         </bb>
         <bb id="c7b5">
            <prec>
               <link type="nottaken" cfg="c7" bb="c7b3"/>
            </prec>
            <inst addr="0x40006954" src="s2" line="44"/>
            <inst addr="0x40006958"/>
            <inst addr="0x4000695C"/>
            <inst addr="0x40006960"/>
            <inst addr="0x40006964"/>
            <inst addr="0x40006968"/>
            <inst addr="0x4000696C"/>
            <inst addr="0x40006970"/>
            <inst addr="0x40006974"/>
            <inst addr="0x40006978"/>
            <inst addr="0x4000697C"/>
            <inst addr="0x40006980"/>
            <inst addr="0x40006984"/>
            <succ>
               <link type="call" cfg="c14" bb="c14b1"/>
               <link type="nottaken" cfg="c7" bb="c7b7"/>
            </succ>
         </bb>
         <bb id="c7b7">
            <prec>
               <link type="nottaken" cfg="c7" bb="c7b5"/>
            </prec>
            <inst addr="0x40006988" src="s2" line="53"/>
            <inst addr="0x4000698C"/>
            <inst addr="0x40006990"/>
            <inst addr="0x40006994"/>
            <inst addr="0x40006998"/>
            <inst addr="0x4000699C"/>
            <succ>
               <link type="call" cfg="c15" bb="c15b1"/>
               <link type="nottaken" cfg="c7" bb="c7b9"/>
            </succ>
         </bb>
         <bb id="c7b9">
            <prec>
               <link type="nottaken" cfg="c7" bb="c7b7"/>
            </prec>
            <inst addr="0x400069A0" src="s2" line="57"/>
            <inst addr="0x400069A4"/>
            <inst addr="0x400069A8"/>
            <inst addr="0x400069AC"/>
            <inst addr="0x400069B0"/>
            <inst addr="0x400069B4"/>
            <inst addr="0x400069B8"/>
            <inst addr="0x400069BC"/>
            <inst addr="0x400069C0"/>
            <inst addr="0x400069C4"/>
            <inst addr="0x400069C8"/>
            <succ>
               <link type="call" cfg="c16" bb="c16b1"/>
               <link type="nottaken" cfg="c7" bb="c7b11"/>
            </succ>
         </bb>
         <bb id="c7b11">
            <prec>
               <link type="nottaken" cfg="c7" bb="c7b9"/>
            </prec>
            <inst addr="0x400069CC" src="s2" line="61"/>
            <inst addr="0x400069D0"/>
            <inst addr="0x400069D4"/>
            <inst addr="0x400069D8"/>
            <inst addr="0x400069DC"/>
            <inst addr="0x400069E0"/>
            <inst addr="0x400069E4"/>
            <inst addr="0x400069E8"/>
            <inst addr="0x400069EC"/>
            <inst addr="0x400069F0"/>
            <inst addr="0x400069F4"/>
            <inst addr="0x400069F8"/>
            <inst addr="0x400069FC"/>
            <inst addr="0x40006A00"/>
            <inst addr="0x40006A04"/>
            <inst addr="0x40006A08"/>
            <inst addr="0x40006A0C"/>
            <inst addr="0x40006A10"/>
            <inst addr="0x40006A14"/>
            <inst addr="0x40006A18"/>
            <inst addr="0x40006A1C"/>
            <inst addr="0x40006A20"/>
            <inst addr="0x40006A24"/>
            <inst addr="0x40006A28"/>
            <inst addr="0x40006A2C"/>
            <inst addr="0x40006A30"/>
            <inst addr="0x40006A34"/>
            <inst addr="0x40006A38"/>
            <inst addr="0x40006A3C"/>
            <inst addr="0x40006A40"/>
            <inst addr="0x40006A44"/>
            <inst addr="0x40006A48"/>
            <inst addr="0x40006A4C"/>
            <inst addr="0x40006A50"/>
            <inst addr="0x40006A54"/>
            <succ>
               <link type="call" cfg="c17" bb="c17b1"/>
               <link type="nottaken" cfg="c7" bb="c7b13"/>
            </succ>
         </bb>
         <bb id="c7b13">
            <prec>
               <link type="nottaken" cfg="c7" bb="c7b11"/>
            </prec>
            <inst addr="0x40006A58" src="s2" line="69"/>
            <inst addr="0x40006A5C"/>
            <inst addr="0x40006A60"/>
         </bb>
      </cfg>
      <cfg id="c12" name="xgnc__guidance__gnc_q4_0_q3_0_q2_0_q1_0">
         <bb id="c12b1">
            <prec>
               <link type="call" cfg="c7" bb="c7b1"/>
            </prec>
            <inst addr="0x40005C4C" src="s3" line="9"/>
            <inst addr="0x40005C50"/>
            <inst addr="0x40005C54"/>
            <inst addr="0x40005C58" src="s3" line="12"/>
            <inst addr="0x40005C5C"/>
            <inst addr="0x40005C60"/>
            <inst addr="0x40005C64"/>
            <inst addr="0x40005C68"/>
            <inst addr="0x40005C6C"/>
            <inst addr="0x40005C70"/>
            <succ>
               <link type="nottaken" cfg="c12" bb="c12b2"/>
               <link type="taken" cfg="c12" bb="c12b3"/>
            </succ>
         </bb>
         <bb id="c12b2">
            <prec>
               <link type="nottaken" cfg="c12" bb="c12b1"/>
            </prec>
            <inst addr="0x40005C74"/>
            <inst addr="0x40005C78"/>
            <inst addr="0x40005C7C"/>
            <succ>
               <link type="nottaken" cfg="c12" bb="c12b4"/>
            </succ>
         </bb>
         <bb id="c12b3">
            <prec>
               <link type="taken" cfg="c12" bb="c12b1"/>
            </prec>
            <inst addr="0x40005C74"/>
            <inst addr="0x40005C80" src="s3" line="13"/>
            <inst addr="0x40005C84"/>
            <inst addr="0x40005C88"/>
            <inst addr="0x40005C8C"/>
            <inst addr="0x40005C90"/>
            <inst addr="0x40005C94" src="s3" line="14"/>
            <inst addr="0x40005C98"/>
            <inst addr="0x40005C9C"/>
            <inst addr="0x40005CA0"/>
            <inst addr="0x40005CA4"/>
            <inst addr="0x40005CA8" src="s3" line="15"/>
            <inst addr="0x40005CAC"/>
            <inst addr="0x40005CB0"/>
            <inst addr="0x40005CB4"/>
            <inst addr="0x40005CB8"/>
            <inst addr="0x40005CBC" src="s3" line="16"/>
            <inst addr="0x40005CC0"/>
            <inst addr="0x40005CC4"/>
            <inst addr="0x40005CC8"/>
            <inst addr="0x40005CCC"/>
            <succ>
               <link type="nottaken" cfg="c12" bb="c12b4"/>
            </succ>
         </bb>
         <bb id="c12b4">
            <prec>
               <link type="nottaken" cfg="c12" bb="c12b2"/>
               <link type="nottaken" cfg="c12" bb="c12b3"/>
            </prec>
            <inst addr="0x40005CD0" src="s3" line="18"/>
            <inst addr="0x40005CD4"/>
            <inst addr="0x40005CD8"/>
         </bb>
      </cfg>
      <cfg id="c13" name="xgnc__guidance__gnc_attitude_calculation_start">
         <bb id="c13b1">
            <prec>
               <link type="call" cfg="c7" bb="c7b3"/>
            </prec>
            <inst addr="0x40005D78" src="s3" line="35"/>
            <inst addr="0x40005D7C"/>
            <inst addr="0x40005D80"/>
            <inst addr="0x40005D84" src="s3" line="38"/>
            <inst addr="0x40005D88"/>
            <inst addr="0x40005D8C"/>
            <succ>
               <link type="call" cfg="c21" bb="c21b1"/>
               <link type="nottaken" cfg="c13" bb="c13b3"/>
            </succ>
         </bb>
         <bb id="c13b3">
            <prec>
               <link type="nottaken" cfg="c13" bb="c13b1"/>
            </prec>
            <inst addr="0x40005D90" src="s3" line="39"/>
            <inst addr="0x40005D94"/>
            <inst addr="0x40005D98"/>
            <succ>
               <link type="call" cfg="c22" bb="c22b1"/>
               <link type="nottaken" cfg="c13" bb="c13b5"/>
            </succ>
         </bb>
         <bb id="c13b5">
            <prec>
               <link type="nottaken" cfg="c13" bb="c13b3"/>
            </prec>
            <inst addr="0x40005D9C" src="s3" line="40"/>
            <inst addr="0x40005DA0"/>
            <inst addr="0x40005DA4"/>
         </bb>
      </cfg>
      <cfg id="c21" name="xgnc__guidance__gnc_attitude_calculation_disable">
         <bb id="c21b1">
            <prec>
               <link type="call" cfg="c13" bb="c13b1"/>
               <link type="call" cfg="c14" bb="c14b13"/>
            </prec>
            <inst addr="0x40005D58" src="s3" line="30"/>
            <inst addr="0x40005D5C"/>
            <inst addr="0x40005D60" src="s3" line="32"/>
            <inst addr="0x40005D64"/>
            <inst addr="0x40005D68"/>
            <inst addr="0x40005D6C" src="s3" line="33"/>
            <inst addr="0x40005D70"/>
            <inst addr="0x40005D74"/>
         </bb>
      </cfg>
      <cfg id="c22" name="xgnc__guidance__gnc_attitude_calculation_init">
         <bb id="c22b1">
            <prec>
               <link type="call" cfg="c13" bb="c13b3"/>
               <link type="call" cfg="c14" bb="c14b5"/>
            </prec>
            <inst addr="0x40005CDC" src="s3" line="20"/>
            <inst addr="0x40005CE0"/>
            <inst addr="0x40005CE4" src="s3" line="22"/>
            <inst addr="0x40005CE8"/>
            <inst addr="0x40005CEC"/>
            <inst addr="0x40005CF0"/>
            <inst addr="0x40005CF4"/>
            <inst addr="0x40005CF8" src="s3" line="23"/>
            <inst addr="0x40005CFC"/>
            <inst addr="0x40005D00"/>
            <inst addr="0x40005D04"/>
            <inst addr="0x40005D08"/>
            <inst addr="0x40005D0C" src="s3" line="24"/>
            <inst addr="0x40005D10"/>
            <inst addr="0x40005D14"/>
            <inst addr="0x40005D18"/>
            <inst addr="0x40005D1C"/>
            <inst addr="0x40005D20" src="s3" line="25"/>
            <inst addr="0x40005D24"/>
            <inst addr="0x40005D28"/>
            <inst addr="0x40005D2C"/>
            <inst addr="0x40005D30"/>
            <inst addr="0x40005D34" src="s3" line="26"/>
            <inst addr="0x40005D38"/>
            <inst addr="0x40005D3C"/>
            <inst addr="0x40005D40" src="s3" line="27"/>
            <inst addr="0x40005D44"/>
            <inst addr="0x40005D48"/>
            <inst addr="0x40005D4C" src="s3" line="28"/>
            <inst addr="0x40005D50"/>
            <inst addr="0x40005D54"/>
         </bb>
      </cfg>
      <cfg id="c14" name="xgnc__guidance__gnc_attitude_calculation">
         <bb id="c14b1">
            <prec>
               <link type="call" cfg="c7" bb="c7b5"/>
            </prec>
            <inst addr="0x40005DA8" src="s3" line="42"/>
            <inst addr="0x40005DAC"/>
            <inst addr="0x40005DB0"/>
            <inst addr="0x40005DB4"/>
            <inst addr="0x40005DB8"/>
            <inst addr="0x40005DBC" src="s3" line="63"/>
            <inst addr="0x40005DC0"/>
            <inst addr="0x40005DC4"/>
            <inst addr="0x40005DC8"/>
            <inst addr="0x40005DCC"/>
            <inst addr="0x40005DD0"/>
            <inst addr="0x40005DD4"/>
            <inst addr="0x40005DD8"/>
            <inst addr="0x40005DDC"/>
            <inst addr="0x40005DE0"/>
            <inst addr="0x40005DE4"/>
            <inst addr="0x40005DE8"/>
            <inst addr="0x40005DEC"/>
            <inst addr="0x40005DF0"/>
            <inst addr="0x40005DF4"/>
            <inst addr="0x40005DF8"/>
            <inst addr="0x40005DFC" src="s3" line="64"/>
            <inst addr="0x40005E00"/>
            <inst addr="0x40005E04"/>
            <inst addr="0x40005E08"/>
            <inst addr="0x40005E0C" src="s3" line="65"/>
            <inst addr="0x40005E10"/>
            <inst addr="0x40005E14"/>
            <inst addr="0x40005E18"/>
            <inst addr="0x40005E1C" src="s3" line="66"/>
            <inst addr="0x40005E20"/>
            <inst addr="0x40005E24"/>
            <inst addr="0x40005E28"/>
            <inst addr="0x40005E2C"/>
            <inst addr="0x40005E30"/>
            <inst addr="0x40005E34"/>
            <inst addr="0x40005E38"/>
            <inst addr="0x40005E3C"/>
            <inst addr="0x40005E40"/>
            <inst addr="0x40005E44"/>
            <inst addr="0x40005E48"/>
            <inst addr="0x40005E4C"/>
            <inst addr="0x40005E50"/>
            <inst addr="0x40005E54"/>
            <inst addr="0x40005E58"/>
            <inst addr="0x40005E5C" src="s3" line="67"/>
            <inst addr="0x40005E60"/>
            <inst addr="0x40005E64"/>
            <inst addr="0x40005E68"/>
            <inst addr="0x40005E6C"/>
            <inst addr="0x40005E70"/>
            <inst addr="0x40005E74"/>
            <inst addr="0x40005E78"/>
            <inst addr="0x40005E7C"/>
            <inst addr="0x40005E80"/>
            <inst addr="0x40005E84"/>
            <inst addr="0x40005E88"/>
            <inst addr="0x40005E8C"/>
            <inst addr="0x40005E90"/>
            <inst addr="0x40005E94"/>
            <inst addr="0x40005E98"/>
            <inst addr="0x40005E9C" src="s3" line="68"/>
            <inst addr="0x40005EA0"/>
            <inst addr="0x40005EA4"/>
            <inst addr="0x40005EA8"/>
            <inst addr="0x40005EAC" src="s3" line="69"/>
            <inst addr="0x40005EB0"/>
            <inst addr="0x40005EB4"/>
            <inst addr="0x40005EB8"/>
            <inst addr="0x40005EBC" src="s3" line="70"/>
            <inst addr="0x40005EC0"/>
            <inst addr="0x40005EC4"/>
            <inst addr="0x40005EC8"/>
            <inst addr="0x40005ECC" src="s3" line="71"/>
            <inst addr="0x40005ED0"/>
            <inst addr="0x40005ED4"/>
            <inst addr="0x40005ED8"/>
            <inst addr="0x40005EDC" src="s3" line="72"/>
            <inst addr="0x40005EE0"/>
            <inst addr="0x40005EE4"/>
            <inst addr="0x40005EE8"/>
            <inst addr="0x40005EEC" src="s3" line="73"/>
            <inst addr="0x40005EF0"/>
            <inst addr="0x40005EF4"/>
            <inst addr="0x40005EF8"/>
            <inst addr="0x40005EFC" src="s3" line="75"/>
            <inst addr="0x40005F00"/>
            <inst addr="0x40005F04"/>
            <inst addr="0x40005F08"/>
            <inst addr="0x40005F0C"/>
            <inst addr="0x40005F10"/>
            <inst addr="0x40005F14"/>
            <succ>
               <link type="nottaken" cfg="c14" bb="c14b2"/>
               <link type="taken" cfg="c14" bb="c14b3"/>
            </succ>
         </bb>
         <bb id="c14b2">
            <prec>
               <link type="nottaken" cfg="c14" bb="c14b1"/>
            </prec>
            <inst addr="0x40005F18"/>
            <inst addr="0x40005F1C"/>
            <inst addr="0x40005F20"/>
            <inst addr="0x40005F38" src="s3" line="78"/>
            <succ>
               <link type="nottaken" cfg="c14" bb="c14b4"/>
            </succ>
         </bb>
         <bb id="c14b3">
            <prec>
               <link type="taken" cfg="c14" bb="c14b1"/>
            </prec>
            <inst addr="0x40005F18"/>
            <inst addr="0x40005F24" src="s3" line="76"/>
            <inst addr="0x40005F28"/>
            <inst addr="0x40005F2C"/>
            <inst addr="0x40005F30"/>
            <inst addr="0x40005F34"/>
            <succ>
               <link type="nottaken" cfg="c14" bb="c14b4"/>
            </succ>
         </bb>
         <bb id="c14b4">
            <prec>
               <link type="nottaken" cfg="c14" bb="c14b2"/>
               <link type="nottaken" cfg="c14" bb="c14b3"/>
            </prec>
            <inst addr="0x40005F3C" src="s3" line="81"/>
            <inst addr="0x40005F40"/>
            <inst addr="0x40005F44"/>
            <inst addr="0x40005F48"/>
            <succ>
               <link type="nottaken" cfg="c14" bb="c14b5"/>
               <link type="taken" cfg="c14" bb="c14b6"/>
            </succ>
         </bb>
         <bb id="c14b5">
            <prec>
               <link type="nottaken" cfg="c14" bb="c14b4"/>
            </prec>
            <inst addr="0x40005F4C"/>
            <inst addr="0x40005F50" src="s3" line="82"/>
            <inst addr="0x40005F54"/>
            <inst addr="0x40005F58"/>
            <succ>
               <link type="call" cfg="c22" bb="c22b1"/>
               <link type="nottaken" cfg="c14" bb="c14b10"/>
            </succ>
         </bb>
         <bb id="c14b6">
            <prec>
               <link type="taken" cfg="c14" bb="c14b4"/>
            </prec>
            <inst addr="0x40005F4C"/>
            <inst addr="0x40005F98" src="s3" line="84"/>
            <inst addr="0x40005F9C"/>
            <inst addr="0x40005FA0"/>
            <inst addr="0x40005FA4"/>
            <succ>
               <link type="nottaken" cfg="c14" bb="c14b8"/>
               <link type="taken" cfg="c14" bb="c14b9"/>
            </succ>
         </bb>
         <bb id="c14b8">
            <prec>
               <link type="nottaken" cfg="c14" bb="c14b6"/>
            </prec>
            <inst addr="0x40005FA8"/>
            <inst addr="0x40005FAC" src="s3" line="85"/>
            <inst addr="0x40005FB0"/>
            <inst addr="0x40005FB4"/>
            <inst addr="0x40005FB8"/>
            <inst addr="0x40005FBC" src="s3" line="86"/>
            <inst addr="0x40005FC0"/>
            <inst addr="0x40005FC4"/>
            <inst addr="0x40005FC8"/>
            <inst addr="0x40005FCC" src="s3" line="87"/>
            <inst addr="0x40005FD0"/>
            <inst addr="0x40005FD4"/>
            <inst addr="0x40005FD8"/>
            <inst addr="0x40005FDC" src="s3" line="88"/>
            <inst addr="0x40005FE0"/>
            <inst addr="0x40005FE4"/>
            <inst addr="0x40005FE8"/>
            <inst addr="0x40005FEC" src="s3" line="89"/>
            <inst addr="0x40005FF0"/>
            <inst addr="0x40005FF4" src="s3" line="90"/>
            <inst addr="0x40005FF8"/>
            <inst addr="0x40005FFC"/>
            <inst addr="0x40006000" src="s3" line="91"/>
            <inst addr="0x40006004"/>
            <inst addr="0x40006008"/>
            <inst addr="0x4000600C"/>
            <inst addr="0x40006010"/>
            <inst addr="0x40006014" src="s3" line="92"/>
            <inst addr="0x40006018"/>
            <inst addr="0x4000601C"/>
            <inst addr="0x40006020"/>
            <inst addr="0x40006024"/>
            <inst addr="0x40006028" src="s3" line="93"/>
            <inst addr="0x4000602C"/>
            <inst addr="0x40006030"/>
            <inst addr="0x40006034"/>
            <inst addr="0x40006038"/>
            <inst addr="0x4000603C" src="s3" line="94"/>
            <inst addr="0x40006040"/>
            <inst addr="0x40006044"/>
            <inst addr="0x40006048"/>
            <inst addr="0x4000604C"/>
            <inst addr="0x40006050"/>
            <inst addr="0x40006054"/>
            <inst addr="0x40006058"/>
            <inst addr="0x4000605C"/>
            <inst addr="0x40006060"/>
            <inst addr="0x40006064"/>
            <inst addr="0x40006068"/>
            <inst addr="0x4000606C"/>
            <inst addr="0x40006070" src="s3" line="95"/>
            <inst addr="0x40006074"/>
            <inst addr="0x40006078"/>
            <inst addr="0x4000607C"/>
            <inst addr="0x40006080" src="s3" line="96"/>
            <inst addr="0x40006084"/>
            <inst addr="0x40006088"/>
            <inst addr="0x4000608C"/>
            <inst addr="0x40006090"/>
            <inst addr="0x40006094"/>
            <inst addr="0x40006098"/>
            <inst addr="0x4000609C"/>
            <inst addr="0x400060A0" src="s3" line="97"/>
            <inst addr="0x400060A4"/>
            <inst addr="0x400060A8"/>
            <inst addr="0x400060AC"/>
            <inst addr="0x400060B0"/>
            <inst addr="0x400060B4"/>
            <inst addr="0x400060B8"/>
            <inst addr="0x400060BC"/>
            <inst addr="0x400060C0" src="s3" line="98"/>
            <inst addr="0x400060C4"/>
            <inst addr="0x400060C8"/>
            <inst addr="0x400060CC"/>
            <inst addr="0x400060D0"/>
            <inst addr="0x400060D4"/>
            <inst addr="0x400060D8" src="s3" line="99"/>
            <inst addr="0x400060DC"/>
            <inst addr="0x400060E0"/>
            <inst addr="0x400060E4"/>
            <inst addr="0x400060E8"/>
            <inst addr="0x400060EC"/>
            <inst addr="0x400060F0"/>
            <succ>
               <link type="nottaken" cfg="c14" bb="c14b11"/>
               <link type="taken" cfg="c14" bb="c14b12"/>
            </succ>
         </bb>
         <bb id="c14b9">
            <prec>
               <link type="taken" cfg="c14" bb="c14b6"/>
            </prec>
            <inst addr="0x40005FA8"/>
            <inst addr="0x40006214" src="s3" line="113"/>
            <inst addr="0x40006218"/>
            <inst addr="0x4000621C"/>
            <inst addr="0x40006220"/>
            <succ>
               <link type="nottaken" cfg="c14" bb="c14b13"/>
               <link type="taken" cfg="c14" bb="c14b14"/>
            </succ>
         </bb>
         <bb id="c14b10">
            <prec>
               <link type="nottaken" cfg="c14" bb="c14b5"/>
            </prec>
            <inst addr="0x40005F5C" src="s3" line="83"/>
            <inst addr="0x40005F60"/>
            <inst addr="0x40005F64"/>
            <inst addr="0x40005F68"/>
            <inst addr="0x40005F6C"/>
            <inst addr="0x40005F70"/>
            <inst addr="0x40005F74"/>
            <inst addr="0x40005F78"/>
            <inst addr="0x40005F7C"/>
            <inst addr="0x40005F80"/>
            <inst addr="0x40005F84"/>
            <inst addr="0x40005F88"/>
            <inst addr="0x40005F8C"/>
            <inst addr="0x40005F90"/>
            <inst addr="0x40005F94"/>
            <succ>
               <link type="nottaken" cfg="c14" bb="c14b15"/>
            </succ>
         </bb>
         <bb id="c14b11">
            <prec>
               <link type="nottaken" cfg="c14" bb="c14b8"/>
            </prec>
            <inst addr="0x400060F4"/>
            <inst addr="0x400060F8"/>
            <inst addr="0x400060FC"/>
            <inst addr="0x40006114" src="s3" line="102"/>
            <inst addr="0x40006118"/>
            <succ>
               <link type="nottaken" cfg="c14" bb="c14b16"/>
            </succ>
         </bb>
         <bb id="c14b12">
            <prec>
               <link type="taken" cfg="c14" bb="c14b8"/>
            </prec>
            <inst addr="0x400060F4"/>
            <inst addr="0x40006100" src="s3" line="100"/>
            <inst addr="0x40006104"/>
            <inst addr="0x40006108"/>
            <inst addr="0x4000610C"/>
            <inst addr="0x40006110"/>
            <succ>
               <link type="nottaken" cfg="c14" bb="c14b16"/>
            </succ>
         </bb>
         <bb id="c14b13">
            <prec>
               <link type="nottaken" cfg="c14" bb="c14b9"/>
            </prec>
            <inst addr="0x40006224"/>
            <inst addr="0x40006228" src="s3" line="114"/>
            <inst addr="0x4000622C"/>
            <inst addr="0x40006230"/>
            <succ>
               <link type="call" cfg="c21" bb="c21b1"/>